,,,,,,,,,,,
,,61300,Aktivitas Telekomunikasi Satelit,Dit PED,Izin penyeleggara jaringa tetap tertutup melalui media satelit,KL Pusat,,,,,
,,,,,Izin Produksi Alat Peralatan Pertahanan dan Keamanan,KL Pusat,,,,,
,,,,,Izin Penetapan Industri Pertahanan,KL Pusat,,,,,
,,,,,Penomoran Telekomunikasi (Non Blok Nomor),KL Pusat,,,,,
,,,,,Hak Labuh Satelit,KL Pusat,,,,,
,,61911,Jasa Panggilan Premium (Premium Call),KL Pusat,Sertifikat Penyelenggaraan Jasa Panggilan Premium (Premium Call),KL Pusat,,,,,
,,61912,Jasa Konten Sms Premium,KL Pusat,Sertifikat Penyelenggaraan Jasa Konten SMS Premium,KL Pusat,,,,,
,,61913,Jasa Internet Teleponi Untuk Keperluan Publik (Itkp),KL Pusat,Izin Penyelenggaraan Jasa Internet Teleponi untuk Keperluan Publik (ITKP),KL Pusat,,,,,
,,,,,Penomoran Telekomunikasi (Non Blok Nomor),KL Pusat,,,,,
,,61914,Jasa Panggilan Terkelola (Calling Card),KL Pusat,Sertifikat Penyelenggaraan Jasa Panggilan Terkelola (Calling Card),KL Pusat,,,,,
,,61919,Jasa Nilai Tambah Teleponi Lainnya,KL Pusat,Sertifikat Penyelenggaraan Jasa Nilai Tambah Teleponi Lainnya,KL Pusat,,,,,
,,,,,Izin Produksi Alat Peralatan Pertahanan dan Keamanan,KL Pusat,,,,,
,,,,,Izin Penetapan Industri Pertahanan,KL Pusat,,,,,
,,61921,Internet Service Provider,Dit PED,Izin Penyelenggaraan Jasa Akses Internet (Internet Service Provider/ISP),KL Pusat,,,,,
,,,,,Izin Produksi Alat Peralatan Pertahanan dan Keamanan,KL Pusat,,,,,
,,,,,Izin Penetapan Industri Pertahanan,KL Pusat,,,,,
,,61922,Jasa Sistem Komunikasi Data,Dit PED,Izin Penyelenggaraan Jasa Sistem Komunikasi Data,KL Pusat,,,,,
,,,,,Izin Produksi Alat Peralatan Pertahanan dan Keamanan,KL Pusat,,,,,
,,,,,Izin Penetapan Industri Pertahanan,KL Pusat,,,,,
,,,,,Hak Labuh Satelit,KL Pusat,,,,,
,,61923,Jasa Televisi Protokol Internet (Iptv),Dit PED,Izin Penyelenggaraan Jasa Televisi Protokol Internet (Internet Protocol Television/IPTV),KL Pusat,,,,,
,,61924,Jasa Interkoneksi Internet (Nap),Dit PED,Izin Penyelenggaraan Jasa Gerbang Akses Internet (Network Access Point/NAP),KL Pusat,,,,,
,,61929,Jasa Multimedia Lainnya,Dit PED,Izin Penyelenggaraan Jasa Multimedia Lainnya,Dit PED,,,,,
,,,,,Sertifikat Standar (Khusus untuk teknologi augmented/ virtual reality),Dit PED,,,,,
,,61991,Aktivitas Telekomunikasi Khusus Untuk Penyiaran,,,,,,,"KBLI 61991 BUKAN merupakan bidang usaha yang secara khusus dapat dijalankan oleh Pelaku Usaha, sehingga tidak diproses melalui Sistem OSS Berbasis Risiko. Hal ini berdasarkan Pasal 101 huruf a PP No.46/2021 tentang Pos, Telekomunikasi dan Penyiaran mengatur bahwa Pasal 51 s.d Pasal 54 PP 52/2000 tentang Telekomunikasi terkait ketentuan mengenai penyelenggaraan telekomunikasi khusus untuk keperluan penyiaran telah dicabut, sehingga KBLI 61991 sudah tidak berlaku.",
,,61992,Aktivitas Telekomunikasi Khusus Untuk Keperluan Sendiri,Dit PED,Izin Penyelenggaraan Telekomunikasi Khusus untuk Keperluan Badan Hukum,KL Pusat,,,,"Seluruh Catatan: Perizinan Berusaha untuk Aktivitas Telekomunikasi Khusus untuk Keperluan Sendiri yang dilakukan oleh Instansi Pemerintah, Perseorangan, dan Dinas Khusus tidak melalui sistem OSS",
,,61993,Aktivitas Telekomunikasi Khusus Untuk Keperluan Pertahanan,KL Pusat,Aktivitas Telekomunikasi Khusus untuk Pertahanan dan Keamanan,KL Pusat,,,,,
,,,,,Izin Produksi Alat Peralatan Pertahanan dan Keamanan,KL Pusat,,,,,
,,,,,Izin Pemasaran,KL Pusat,,,,,
,,61994,Jasa Jual Kembali Jasa Telekomunikasi,Dit PED,Sertifikat Penyelenggaraan Jual Kembali Jasa Telekomunikasi,KL Pusat,,,,,
,,61999,Aktivitas Telekomunikasi Lainnya Ytdl,Dit PED,,,,,,,
,,62011,Aktivitas Pengembangan Video Game,DIt DKB,Sertifikat Standar,Dit PED,,,,,
,,62012,Aktivitas Pengembangan Aplikasi Perdagangan Melalui Internet (E-,DIt DKB,Sertifikat Standar,DIt DKB,,,,,
,,62013,Aktivitas Pemrograman Dan Produksi Konten Media Imersif,DIt DKB,Sertifikat Standar,DIt DKB,,,,,
,,,,,Izin Produksi Alat Peralatan Pertahanan dan Keamanan,KL Pusat,,,,,
,,,,,Izin Penetapan Industri Pertahanan,KL Pusat,,,,,
,,62014,Aktivitas Pengembangan Teknologi Blockchain,DIt DKB,Sertifikat Standar,KL Pusat,,,,,
,,62015,Aktivitas Pemrograman Berbasis Kecerdasan Artifisial,DIt DKB,Sertifikat Standar,KL Pusat,,,,,
,,,,,Izin Produksi Alat Peralatan Pertahanan dan Keamanan,KL Pusat,,,,,
,,,,,Izin Penetapan Industri Pertahanan,KL Pusat,,,,,
,,62019,Aktivitas Pemrograman Komputer Lainnya,DIt DKB,Sertifikat Standar,DIt DKB,,,,,
,,62021,Aktivitas Konsultasi Keamanan Informasi,DIt DKB,Sertifikat Standar,DIt DKB,,,,,
,,,,,Izin Produksi Alat Peralatan Pertahanan dan Keamanan,KL Pusat,,,,,
,,,,,Izin Penetapan Industri Pertahanan,KL Pusat,,,,,
,,,,,Izin Pemasaran,KL Pusat,,,,,
,,62022,Aktivitas Penyediaan Identitas Digital,DIt DKB,Sertifikat Standar,KL Pusat,,,,,
,,62023,Aktivitas Penyediaan Sertifikat Elektronik Dan Layanan Yang Menggunakan Sertifikat Elektronik,DIt DKB,Sertifikat Standar,KL Pusat,,,,,
,,62024,Aktivitas Konsultasi Dan Perancangan Internet Of Things (Iot),DIt DKB,Sertifikat Standar,KL Pusat,,,,,
,,,,,Izin Produksi Alat Peralatan Pertahanan dan Keamanan,KL Pusat,,,,,
,,,,,Izin Penetapan Industri Pertahanan,KL Pusat,,,,,
,,,,,Izin Pemasaran,KL Pusat,,,,,
,,62029,Aktivitas Konsultasi Komputer Dan Manajemen Fasilitas Komputer,DIt DKB,Sertifikat Standar,DIt DKB,,,,,
,,,,,Izin edar alat kesehatan dalam negeri,KL Pusat,,,,,
,,,,,Surat keterangan pendukung ekspor impor - sertifikat bebas jual untuk produk dalam negeri,KL Pusat,,,,,
,,,,,Surat keterangan pendukung ekspor impor - sertifikat pemberitahuan ekspor,KL Pusat,,,,,
,,,,,Sertifikat Cara Pembuatan Alat Kesehatan yang Baik (CPAKB),KL Pusat,,,,,
,,,,,Izin edar alat kesehatan impor,KL Pusat,,,,,
,,62090,Aktivitas Teknologi Informasi Dan Jasa Komputer Lainnya,DIt DKB,Sertifikat Standar (untuk Usaha Besar),DIt DKB,,,,,
,,63111,Aktivitas Pengolahan Data,DIt DKB,Sertifikat Standar,DIt DKB,,,,,
,,63112,Aktivitas Hosting Dan Ybdi,DIt DKB,Sertifikat Standar,DIt DKB,,,,,
,,63121,Portal Web Dan/Atau Platform Digital Tanpa Tujuan Komersial,DIt DKB,Sertifikat Standar (untuk Usaha Besar),DIt DKB,,,,,
,,63122,Portal Web Dan/Atau Platform Digital Dengan Tujuan Komersial,DIt DKB,Surat Izin Usaha Perdagangan Melalui Sistem Elektronik (SIUPMSE),KL Pusat,,,,,
,,,,,Sertifikat Standar (Selain Penyelenggara Perdagangan Melalui Sistem Elektronik (PPMSE) dan Penyelenggara Sarana Perantara (PSP),DIt DKB,,,,,
,,95110,Reparasi Komputer Dan Peralatan Sejenisnya,DIt DKB,Sertifikat Standar (untuk Usaha Menengah dan Usaha Besar),DIt DKB,,,,,
,,95120,Reparasi Peralatan Komunikasi,DIt DKB,Sertifikat Standar (untuk Usaha Menengah dan Usaha Besar),DIt DKB,,,,,
,,,,,Izin Produksi Alat Peralatan Pertahanan dan Keamanan,KL Pusat,,,,,
,,,,,Izin Penetapan Industri Pertahanan,KL Pusat,,,,,
,,95210,Reparasi Alat-Alat Elektronik Konsumen,DIt DKB,Sertifikat Standar (untuk Usaha Menengah dan Usaha Besar),DIt DKB,,,,,
,,43212,Instalasi Telekomunikasi,Dit PED,Sertifikat Standar,Dit PED,,,,,
,,,,,Izin Produksi Alat Peralatan Pertahanan dan Keamanan,KL Pusat,,,,,
,,,,,Izin Penetapan Industri Pertahanan,KL Pusat,,,,,
,,43213,Instalasi Elektronika,Dit PED,Sertifikat Standar,Dit PED,,,,,
,,,,,Izin Produksi Alat Peralatan Pertahanan dan Keamanan,KL Pusat,,,,,
,,,,,Izin Penetapan Industri Pertahanan,KL Pusat,,,,,
,,43215,Instalasi Sinyal Dan Telekomunikasi Kereta Api,Dit PED,Sertifikat Standar,Dit PED,,,,,
,,43216,Instalasi Sinyal Dan Rambu-Rambu Jalan Raya,Dit PED,Sertifikat Standar,Dit PED,,,,,
,,,,,,,,,,,
"P. BIDANG KOPERASI, USAHA KECIL, MENEGAH",,,,,,,,,,,
,,64141,Koperasi Simpan Pinjam Primer (Ksp Primer),Dit Pemas,,,,,,,
,,64142,Unit Simpan Pinjam Koperasi Primer (Usp Koperasi Primer),Dit Pemas,,,,,,,
,,64143,Koperasi Simpan Pinjam Sekunder (Ksp Sekunder),Dit Pemas,,,,,,,
,,64144,Unit Simpan Pinjam Koperasi Sekunder (Usp Koperasi Sekunder),Dit Pemas,,,,,,,
,,64145,Koperasi Simpan Pinjam Dan Pembiayaan Syariah Primer (Kspps,Dit Pemas,,,,,,,
,,64146,Unit Simpan Pinjam Dan Pembiayaan Syariah Koperasi Primer (Uspps,Dit Pemas,,,,,,,
,,64147,Koperasi Simpan Pinjam Dan Pembiayaan Syariah Sekunder (Kspps,Dit Pemas,,,,,,,
,,64148,Unit Simpan Pinjam Dan Pembiayaan Syariah Koperasi Sekunder,Dit Pemas,,,,,,,
,,64151,Lembaga Keuangan Mikro Konvensional,Dit Pemas,,,,,,,
,,64152,Lembaga Keuangan Mikro Syariah,Dit Pemas,,,,,,,
,,66292,"Aktivitas Pemeringkat Usaha Mikro, Kecil, Menengah Dan Koperasi",Dit Pemas,,,,,,,
Q. BIDANG PENANAMAN MODAL,,,,,,,,,,,
Penanaman Modal,Keuangan,64110,Bank Sentral,Dit Pendanaan,-,,,,,,
,,64121,Bank Umum Konvensional,Dit Pendanaan,-,,,,,,
,,64122,Bank Umum Syariah,Dit Pendanaan,-,,,,,,
,,64123,Unit Usaha Syariah Bank Umum,Dit Pendanaan,-,,,,,,
,,64131,Bank Perkreditan Rakyat,Dit Pendanaan,-,,,,,,
,,64132,Bank Pembiayaan Rakyat Syariah,Dit Pembiayaan,-,,,,,,
,,64151,Lembaga Keuangan Mikro Konvensional,Biro Keu  BMN/ADP,-,,,,,,
,,64152,Lembaga Keuangan Mikro Syariah,Biro Keu  BMN/ADP,-,,,,,,
,,64190,Perantara Moneter Lainnya,Biro Keu  BMN/ADP,-,,,,,,
,,64200,Aktivitas Perusahaan Holding,Dit IKB,-,,,,,,
,,64300,"Trust, Pendanaan Dan Entitas Keuangan Sejenis",Dit Pendanaan,-,,,,,,
,,64400,Otoritas Jasa Keuangan (OJK),Dit Pendanaan,-,,,,,,
,,64500,Lembaga Penjamin Simpanan (LPS),Dit Pendanaan,-,,,,,,
,,64911,Perusahaan Pembiayaan Konvensional,Dit Pembiayaan,-,,,,,,
,,64912,Perusahaan Pembiayaan Syariah,Dit Pembiayaan,-,,,,,,
,,64913,Unit Usaha Syariah Perusahaan Pembiayaan,Dit Pembiayaan,-,,,,,,
,,64921,Pergadaian Konvensional,Dit Pembiayaan,-,,,,,,
,,64922,Pergadaian Syariah,Dit Pembiayaan,-,,,,,,
,,64923,Unit Usaha Syariah Pergadaian,Dit Pembiayaan,-,,,,,,
,,64931,Perusahaan Modal Ventura Konvensional,Dit IKB,-,,,,,,
,,64932,Perusahaan Modal Ventura Syariah,Dit IKB,-,,,,,,
,,64933,Unit Usaha Syariah Modal Ventura,Dit IKB,-,,,,,,
,,64941,Perusahaan Pembiayaan Infrastruktur Konvensional,Dit Pembiayaan,-,,,,,,
,,64942,Perusahaan Pembiayaan Infrastruktur Syariah,Dit Pembiayaan,-,,,,,,
,,64943,Unit Usaha Syariah Perusahaan Pembiayaan Infrastruktur,Dit Pembiayaan,-,,,,,,
,,64951,Layanan Pinjam Meminjam Uang Berbasis Teknologi Informasi,Dit Pembiayaan,-,,,,,,
,,64953,Unit Usaha Syariah Layanan Pinjam Meminjam Uang Berbasis,Dit Pembiayaan,-,,,,,,
,,64991,Lembaga Pembiayaan Ekspor Indonesia,Dit Pembiayaan,-,,,,,,
,,64992,Perusahaan Pembiayaan Sekunder Perumahan,Dit Pembiayaan,-,,,,,,
,,64999,"Aktivitas Jasa Keuangan Lainnya YTDL, Bukan Asuransi dan Dana",Biro Keu  BMN/ADP,-,,,,,,
,,65111,Asuransi Jiwa Konvensional,Biro SDM,-,,,,,,
,,65112,Asuransi Jiwa Syariah,Biro SDM,-,,,,,,
,,65113,Unit Syariah Asuransi Jiwa,Biro SDM,-,,,,,,
,,65121,Asuransi Umum Konvensional,Biro SDM,-,,,,,,
,,65122,Asuransi Umum Syariah,Biro SDM,-,,,,,,
,,65123,Unit Syariah Asuransi Umum,Biro SDM,-,,,,,,
,,65131,Perusahaan Penjaminan Konvensional,,-,,,,,,
,,65132,Perusahaan Penjaminan Syariah,,-,,,,,,
,,65133,Unit Usaha Syariah Perusahaan Penjaminan,,-,,,,,,
,,65211,Reasuransi Konvensional,Biro SDM,-,,,,,,
,,65212,Reasuransi Syariah,Biro SDM,-,,,,,,
,,65213,Unit Syariah Reasuransi,Biro SDM,-,,,,,,
,,65221,Perusahaan Penjaminan Ulang Konvensional,,-,,,,,,
,,65222,Perusahaan Penjaminan Ulang Syariah,,-,,,,,,
,,65311,Dana Pensiun Pemberi Kerja Konvensional,Dit Pendanaan,-,,,,,,
,,65312,Dana Pensiun Pemberi Kerja Syariah,Dit Pendanaan,-,,,,,,
,,65313,Unit Syariah Dana Pensiun Pemberi Kerja,Dit Pendanaan,-,,,,,,
,,65321,Dana Pensiun Lembaga Keuangan Konvensional,Dit Pendanaan,-,,,,,,
,,65322,Dana Pensiun Lembaga Keuangan Syariah,Dit Pendanaan,-,,,,,,
,,66111,Bursa Efek,Dit Pendanaan,-,,,,,,
,,66112,Lembaga Kliring dan Penjaminan Efek,Dit IKB,-,,,,,,
,,66113,Lembaga Penyimpanan Dan Penyelesaian,,-,,,,,,
,,66114,Lembaga Penilaian Harga Efek (LPHE),Dit IKB,-,,,,,,
,,66115,Penyelenggara Dana Perlindungan Pemodal (PDPP),Dit IKB,-,,,,,,
,,66116,Lembaga Pendanaan Efek,Dit Pendanaan,-,,,,,,
,,66117,Penyelenggara Pasar Alternatif,Dit IKB,-,,,,,,
,,66118,Penyelenggara Penawaran Efek Melalui Layanan Urun Dana,Dit IKB,-,,,,,,
,,66119,Penyelenggara Infrastruktur Perdagangan di Pasar Modal Lainnya,Dit IKB,-,,,,,,
,,66121,Bursa Berjangka,Dit IKB,-,,,,,,
,,66122,Lembaga Kliring Dan Penjaminan Berjangka,,-,,,,,,
,,66123,Bursa Berjangka Penyelenggara Pasar Fisik,Dit IKB,-,,,,,,
,,66124,Lembaga Kliring Dan Penjaminan Berjangka Penyelenggara Pasar,Dit IKB,-,,,,,,
,,66131,Penyelenggara Sarana Pelaksanaan Transaksi di Pasar Uang dan,Dit IKB,-,,,,,,
,,66132,Central Counterparty Transaksi Derivatif Suku Bunga dan Nilai,Dit IKB,-,,,,,,
,,66139,Penyelenggara Infrastruktur Pasar Uang dan Pasar Valuta Asing,Dit IKB,-,,,,,,
,,66141,Penjamin Emisi Efek (Underwriter),Dit IKB,-,,,,,,
,,66142,Perantara Pedagang Efek (Broker Dealer),Dit IKB,-,,,,,,
,,66143,Perusahaan Efek Daerah (PED),Dit IKB,-,,,,,,
,,66144,Perantara Pedagang Efek untuk Efek Bersifat Utang dan Sukuk,Dit IKB,-,,,,,,
,,66145,Agen Perantara Pedagang Efek,Dit IKB,-,,,,,,
,,66146,Agen Penjual Efek Reksa Dana (APERD),Dit IKB,-,,,,,,
,,66147,Gerai Penjualan Efek Reksa Dana,Dit IKB,-,,,,,,
,,66149,Perusahaan Efek Selain Manajemen Investasi Lainnya,Dit IKB,-,,,,,,
,,66151,Pedagang Berjangka,,-,,,,,,
,,66152,Pialang Perdagangan Berjangka,,-,,,,,,
,,66153,Pedagang Fisik Komoditi,,-,,,,,,
,,66154,Perantara Perdagangan Fisik Komoditi,,-,,,,,,
,,66159,Perantara Perdagangan Berjangka Komoditi Lainnya,,-,,,,,,
,,66160,Kegiatan Penukaran Valuta Asing (Money Changer),Dit Pembiayaan,-,,,,,,
,,66171,Penyelenggara Sistem Perdagangan Alternatif,Biro Umum/PBJ,-,,,,,,
,,66172,Pengelola Sentra Dana Berjangka,,-,,,,,,
,,66173,Penasihat Berjangka,Biro Keu  BMN/ADP,-,,,,,,
,,66174,Pengelola Tempat Penyimpanan Fisik Komoditi,,-,,,,,,
,,66179,Aktivitas Penunjang Perdagangan Berjangka Komoditi Lainnya,KL Pusat,-,,,,,,
,,66191,Biro Administrasi Efek,Dit IKB,-,,,,,,
,,66192,Kustodian (Custodian),Dit IKB,-,,,,,,
,,66193,Wali Amanat (Trustee),,-,,,,,,
,,66194,Perusahaan Pemeringkat Efek,Dit IKB,-,,,,,,
,,66195,Ahli Syariah Pasar Modal (ASPM),Dit IKB,-,,,,,,
,,66199,Aktivitas Penunjang Jasa Keuangan Lainnya YTDL,,-,,,,,,
,,66211,Aktivitas Penilai Risiko Asuransi,,-,,,,,,
,,66212,Aktivitas Penilai Kerugian Asuransi,,-,,,,,,
,,66221,Aktivitas Agen Asuransi,,-,,,,,,
,,66222,Aktivitas Pialang Asuransi,,-,,,,,,
,,66223,Aktivitas Pialang Reasuransi,,-,,,,,,
,,66224,Aktivitas Agen Penjamin,KL Pusat,-,,,,,Berdasarkan keterangan pada Sistem OSS,
,,66225,Aktivitas Broker Penjaminan,,-,,,,,,
,,66226,Aktivitas Broker Penjaminan Ulang,,-,,,,,,
,,66291,Aktivitas Konsultan Aktuaria,Dit Pendanaan,-,,,,,,
,,66292,"Aktivitas Pemeringkat Usaha Mikro, Kecil, Menengah dan Koperasi",Dit Pemas,-,,,,,,
,,66299,Aktivitas Penunjang Asuransi dan Dana Pensiun Lainnya,Dit Pendanaan,-,,,,,,
,,66311,Manajer Investasi,Dit IKB,-,,,,,,
,,66312,Manajer Investasi Syariah,Dit IKB,-,,,,,,
,,66321,Penasihat Investasi Perorangan,Dit IKB,-,,,,,,
,,66322,Penasihat Investasi Berbentuk Perusahaan,Dit IKB,-,,,,,,
,,66390,Aktivitas Manajemen Dana Lainnya,Dit Pendanaan,-,,,,,,
,,66411,Penyedia Jasa Pembayaran (PJP),Dit Pembiayaan,-,,,,,,
,,66412,Penyelenggara Infrastruktur Sistem Pembayaran (PIP),Dit Pembiayaan,-,,,,,,
,,66413,Penyelenggara Penunjang Sistem Pembayaran,Dit Pembiayaan,-,,,,,,
,,66420,Penyelenggara Kegiatan Jasa Pengolahan Uang Rupiah,Biro Keu  BMN/ADP,-,,,,,,
,,69101,Aktivitas Pengacara,Dit Hukum,-,,Nonberusaha,Dit Hukum,,,
,,69102,Aktivitas Konsultan Hukum,Dit Hukum,-,,,,,,
,,69103,Aktivitas Konsultan Kekayaan Intelektual,,-,,Nonberusaha,,,,
,,69104,Aktivitas Notaris Dan Pejabat Pembuat Akta Tanah,Biro Keu  BMN/ADP,-,,Nonberusaha,Biro Keu  BMN/ADP,,,
,,69109,Aktivitas Hukum Lainnya,Dit Hukum,-,,Nonberusaha,Dit Hukum,,,
,,69201,"Aktivitas Akuntansi, Pembukuan Dan Pemeriksa",Biro Keu  BMN/ADP,-,,,,,,
,,69202,Aktivitas Konsultasi Pajak,Biro Keu  BMN/ADP,-,,,,,,
R. BIDANG KEPEMUDAAN DAN OLAHRAGA,,,,,,,,,,,
,,,Izin Penyelenggaran Kejuaraan/Event Olahraga,Dit Budparekraf,,Dit Budparekraf,Izin Penyelenggaraan Kejuaraan/Event Olahraga,,,,
,,,Izin Usaha Fasilitas Olahraga,Dit Budparekraf,,Dit Budparekraf,Izin usaha fasilitas olahraga,,,,
,,,Rekomendasi Pendirian Sekolah Olahraga,Dit Budparekraf,,Dit Budparekraf,Rekomendasi Pendirian Sekolah olahraga,,,,
,,,Izin mempekerjakan Tenaga Asing,Dit Budparekraf,,Dit Budparekraf,Izin mempekerjakan tenaga asing,,,,
,,,Tanda daftar Organisasi Kemasyarakatan Pemuda (OKP),Dit Budparekraf,,Dit Budparekraf,Tanda daftar ORganisasi Kemasyarakatan Pemuda,,,,
,,,Rekomendasi Penyelenggaraan Pertukaran Pemuda,Dit Budparekraf,,Dit Budparekraf,Rekomendasi Penyelenggaraan pertukaran pemuda,,,,
,,,Rekomendasi pemberian penghargaan Kepemudaan,Dit Budparekraf,,Dit Budparekraf,Rekomendasi pemberian penghargaan kepemudaan,,,,
,,93111,Fasilitas Stadion,Dit Budparekraf,Sertifikat Laik Sehat,KL Pusat,,,,,
,,93112,Fasilitas Sirkuit,Dit Budparekraf,Sertifikat Laik Sehat,KL Pusat,,,,,
,,93113,Fasilitas Gelanggang/Arena,Dit Budparekraf,Sertifikat Laik Sehat,KL Pusat,,,,,
,,93114,Fasilitas Lapangan,Dit Budparekraf,Sertifikat Laik Sehat,KL Pusat,,,,,
,,93115,Fasilitas Olahraga Beladiri,Dit Budparekraf,Sertifikat Laik Sehat,KL Pusat,,,,,
,,93116,Fasilitas Pusat Kebugaran/ Fitness Center,Dit Budparekraf,Sertifikat Laik Sehat,KL Pusat,,,,,
,,93119,Pengelolaan Fasilitas Olah Raga Lainnya,Dit Budparekraf,-,,,,,,
,,93121,Klub Sepak Bola,Dit Budparekraf,-,,,,,,
,,93122,Klub Golf,Dit Budparekraf,-,,,,,,
,,93123,Klub Renang,Dit Budparekraf,-,,,,,,
,,93124,Klub Tenis Lapangan,Dit Budparekraf,-,,,,,,
,,93125,Klub Tinju,Dit Budparekraf,-,,,,,,
,,93126,Klub Bela Diri,Dit Budparekraf,-,,,,,,
,,93127,Klub Kebugaran/Fitness Dan Binaraga,Dit Budparekraf,-,,,,,,
,,93128,Klub Bowling,Dit Budparekraf,-,,,,,,
,,93129,Klub Olahraga Lainnya,Dit Budparekraf,-,,,,,,
,,93191,Promotor Kegiatan Olahraga,Dit Budparekraf,-,,,,,,
,,93192,"Olahragawan, Juri Dan Wasit Profesional",Dit Budparekraf,-,,,,,,
,,,,,,,,,,,
,,,,,,,,,,,
,,,,,,,,,,,
,,,,,,,,,,,
T. BIDANG KEBUDAYAAN,,,,,,,,,,,
,,90011,Aktivitas Seni Pertunjukan,Dit Budparekraf,Sertifikat laik sehat,Dit Budparekraf,,,,,
,,90012,Aktivitas Penunjang Seni Pertunjukan,Dit Budparekraf,,,,,,,
,,90021,Pelaku Kreatif Seni Pertunjukan,Dit Budparekraf,,,,,,,
,,90022,Pelaku Kreatif Seni Musik,Dit Budparekraf,,,,,,,
,,90023,Aktivitas Pelaku Kreatif Seni Rupa,Dit Budparekraf,,,,,,,
,,90024,Aktivitas Penulis Dan Pekerja Sastra,Dit Budparekraf,,,,,,,
,,90025,Jurnalis Berita Independen,Dit Budparekraf,,,,,,,
,,90029,Aktivitas Pekerja Seni Dan Pekerja Kreatif Lainnya,Dit Budparekraf,,,,,,,
,,90030,Aktivitas Impresariat Bidang Seni Dan Festival Seni,Dit Budparekraf,,,,,,,
,,90040,Aktivitas Operasional Fasilitas Seni,Dit Budparekraf,,,,,,,
,,90090,"Aktivitas Hiburan, Seni Dan Kreativitas Lainnya",Dit Budparekraf,,,,,,,
,,91011,Perpustakaan Dan Arsip Pemerintah,Dit Budparekraf,,,Izin pengelolaan perpustakaan dan arsip yang dikelola pemerintah,Dit Budparekraf,,"Perizinan tidak diproses melalui Sistem OSS Berbasis Risiko, agar melihat ketentuan peraturan perundang-undangan terkait",
,,91012,Perpustakaan Dan Arsip Swasta,Dit Budparekraf,,,,,,,
,,91021,Museum Yang Dikelola Pemerintah,Dit Budparekraf,,,Izin pengelolaan museum yang dikelola pemerintah,Dit Budparekraf,,"Perizinan tidak diproses melalui Sistem OSS Berbasis Risiko, agar melihat ketentuan peraturan perundang-undangan terkait",
,,91022,Museum Yang Dikelola Swasta,Dit Budparekraf,,,,,,,
,,91023,Peninggalan Sejarah/Cagar Budaya Yang Dikelola Pemerintah,Dit Budparekraf,,,Izin pengelolaan peninggalan sejarah/ cagar budaya yang dikelola pemerintah,Dit Budparekraf,,"Perizinan tidak diproses melalui Sistem OSS Berbasis Risiko, agar melihat ketentuan peraturan perundang-undangan terkait",
,,91024,Peninggalan Sejarah/Cagar Budaya Yang Dikelola Swasta,Dit Budparekraf,,,,,,,
,,91025,Taman Budaya,Dit Budparekraf,,,,,,,
,,91029,Wisata Budaya Lainnya,Dit Budparekraf,,,,,,,
,,91031,Taman Konservasi Di Luar Habitat Alami (Ex-Situ),Dit Budparekraf,,,,,,,
,,91032,Taman Nasional,Dit Budparekraf,,,,,,,
,,91033,Taman Hutan Raya,Dit Budparekraf,,,,,,,
,,91034,Taman Wisata Alam,Dit Budparekraf,,,,,,,
,,91035,Suaka Margasatwa,Dit Budparekraf,,,,,,,
,,91036,Taman Laut,Dit Budparekraf,,,,,,,
,,91037,Kawasan Buru,Dit Budparekraf,,,,,,,
,,91038,Hutan Lindung,Dit Budparekraf,,,Izin pengelolaan hutan lindung,Dit PPKSDA,,"Perizinan tidak diproses melalui Sistem OSS Berbasis Risiko, agar melihat ketentuan peraturan perundang-undangan terkait",
,,91039,Aktivitas Kawasan Alam Lainnya,Dit Budparekraf,,,,,,,
,,94990,Aktivitas Organisasi Keanggotaan Lainnya Ytdl,Dit Budparekraf,,,Izin aktivitas organisasi keanggotaan lainnya ,Biro SDM,,"Perizinan tidak diproses melalui Sistem OSS Berbasis Risiko, agar melihat ketentuan peraturan perundang-undangan terkait",
,,59132,"Aktivitas distribusi film, video, dan program",Dit Budparekraf,,,,,,,
,,59140,Aktivitas pemutaran film,Dit Budparekraf,,,,,,,
,,77220,"Aktivitas penyewaan kaset video, cd, vcd/dvd dan sejenisnya",Dit Budparekraf,,,,,,,
,,59112,"Aktivitas produksi film, video dan program televisi oleh swasta",Dit Budparekraf,,,,,,,
,,96999,Aktivitas jasa perorangan lainnya,Dit Budparekraf,,,,,,,
W. BIDANG KELAUTAN DAN PERIKANAN,,,,,,,,,,,
,,03111,Penangkapan Pisces/Ikan Bersirip Di Laut,Dit KP,"- Tanda Daftar Kegiatan Penangkapan Ikan di Kawasan Konservasi
- Surat Izin Usaha Perikanan",Dit KP,,,,,
,,03112,Penangkapan Crustacea Di Laut,Dit KP,"- Tanda Daftar Kegiatan Penangkapan Ikan di Kawasan Konservasi
- Surat Izin Usaha Perikanan",Dit KP,,,,,
,,03113,Penangkapan Mollusca Di Laut,Dit KP,"- Tanda Daftar Kegiatan Penangkapan Ikan di Kawasan Konservasi
- Surat Izin Usaha Perikanan",Dit KP,,,,,
,,03114,Penangkapan/Pengambilan Tumbuhan Air Di Laut,Dit KP,,,,,,,
,,03115,Penangkapan/Pengambilan Induk/Benih Ikan Di Laut,Dit KP,"- Tanda Daftar Kegiatan Penangkapan Ikan di Kawasan Konservasi
- Surat Izin Usaha Perikanan",Dit KP,,,,,
,,03116,Penangkapan Echinodermata Di Laut,Dit KP,"- Tanda Daftar Kegiatan Penangkapan Ikan di Kawasan Konservasi
- Surat Izin Usaha Perikanan",Dit KP,,,,,
,,03117,Penangkapan Coelenterata Di Laut,Dit KP,"- Tanda Daftar Kegiatan Penangkapan Ikan di Kawasan Konservasi
- Surat Izin Usaha Perikanan",Dit KP,,,,,
,,03118,Penangkapan Ikan Hias Laut,Dit KP,"- Tanda Daftar Kegiatan Penangkapan Ikan di Kawasan Konservasi
- Surat Izin Usaha Perikanan",Dit KP,,,,,
,,03119,Penangkapan Biota Air Lainnya Di Laut,Dit KP,"- Tanda Daftar Kegiatan Penangkapan Ikan di Kawasan Konservasi
- Surat Izin Usaha Perikanan",Dit KP,,,,,
,,03121,Penangkapan Pisces/Ikan Bersirip Di Perairan Darat,Dit KP,- Surat Izin Usaha Perikanan,Dit KP,,,,,
,,03122,Penangkapan Crustacea Di Perairan Darat,Dit KP,,,,,,,
,,03123,Penangkapan Mollusca Di Perairan Darat,Dit KP,,,,,,,
,,03124,Penangkapan/Pengambilan Tumbuhan Air Di Perairan Darat,Dit KP,,,,,,,
,,03125,Penangkapan/Pengambilan Induk/Benih Ikan Di Perairan Darat,Dit KP,,,,,,,
,,03126,Penangkapan Ikan Hias Di Perairan Darat,Dit KP,- Surat Izin Usaha Perikanan,Dit KP,,,,,
,,03129,Penangkapan Biota Air Lainnya Di Perairan Darat,Dit KP,- Surat Izin Usaha Perikanan,Dit KP,,,,,
,,03131,Jasa Sarana Produksi Penangkapan Ikan Di Laut,Dit KP,,,,,,,
,,03132,Jasa Produksi Penangkapan Ikan Di Laut,Dit KP,,,,,,,
,,03133,Jasa Pasca Panen Penangkapan Ikan Di Laut,Dit KP,,,,,,,
,,03141,Jasa Sarana Produksi Penangkapan Ikan Di Perairan Darat,Dit KP,,,,,,,
,,03142,Jasa Produksi Penangkapan Ikan Di Perairan Darat,Dit KP,,,,,,,
,,03151,Penangkapan/Pengambilan Ikan Bersirip (Pisces) Yang Dilindungi,Dit KP,,,,,,,
,,03152,Penangkapan/Pengambilan Crustacea Yang Dilindungi Dan/Atau,Dit KP,,,,,,,
,,03153,Penangkapan/Pengambilan Mollusca Yang Dilindungi Dan/Atau,Dit KP,,,,,,,
,,03154,Penangkapan/Pengambilan Coelenterata Yang Dilindungi Dan/Atau,Dit KP,,,,,,,
,,03155,Penangkapan/Pengambilan Echinodermata Yang Dilindungi,Dit KP,,,,,,,
,,03156,Penangkapan/Pengambilan Amphibia Yang Dilindungi Dan/Atau,Dit KP,,,,,,,
,,03157,Penangkapan/Pengambilan Reptilia Yang Dilindungi Dan/Atau,Dit KP,,,,,,,
,,03158,Penangkapan/Pengambilan Mamalia Yang Dilindungi Dan/Atau,Dit KP,,,,,,,
,,03159,Penangkapan/Pengambilan Algae Dan Biota Perairan Lainnya Yang,Dit KP,,,,,,,
,,03211,Pembesaran Pisces/ Ikan Bersirip Laut,Dit KP,Sertifikat Cara Budidaya Ikan yang Baik,Dit KP,,,,,
,,03212,Pembenihan Ikan Laut,Dit KP,Sertifikat Cara Pembenihan Ikan yang Baik,Dit KP,,,,,
,,03213,Budidaya Ikan Hias Air Laut,Dit KP,Sertifikat Cara Budidaya Ikan yang Baik,Dit KP,,,,,
,,03214,Budidaya Karang (Coral),Dit KP,Sertifikat Cara Budidaya Ikan yang Baik,Dit KP,,,,,
,,03215,Pembesaran Mollusca Laut,Dit KP,Sertifikat Cara Budidaya Ikan yang Baik,Dit KP,,,,,
,,03216,Pembesaran Crustacea Laut,Dit KP,Sertifikat Cara Budidaya Ikan yang Baik,Dit KP,,,,,
,,03217,Pembesaran Tumbuhan Air Laut,Dit KP,Sertifikat Cara Budidaya Ikan yang Baik,Dit KP,,,,,
,,03219,Budidaya Biota Air Laut Lainnya,Dit KP,Sertifikat Cara Budidaya Ikan yang Baik,Dit KP,,,,,
,,03221,Pembesaran Ikan Air Tawar Di Kolam,Dit KP,Sertifikat Cara Budidaya Ikan yang Baik,Dit KP,,,,,
,,03222,Pembesaran Ikan Air Tawar Di Karamba Jaring Apung,Dit KP,Sertifikat Cara Budidaya Ikan yang Baik,Dit KP,,,,,
,,03223,Pembesaran Ikan Air Tawar Di Karamba,Dit KP,Sertifikat Cara Budidaya Ikan yang Baik,Dit KP,,,,,
,,03224,Pembesaran Ikan Air Tawar Di Sawah,Dit KP,Sertifikat Cara Budidaya Ikan yang Baik,Dit KP,,,,,
,,03225,Budidaya Ikan Hias Air Tawar,Dit KP,Sertifikat Cara Budidaya Ikan yang Baik,Dit KP,,,,,
,,03226,Pembenihan Ikan Air Tawar,Dit KP,Sertifikat Cara Budidaya Ikan yang Baik,Dit KP,,,,,
,,03227,Pembesaran Ikan Air Tawar Di Karamba Jaring Tancap,Dit KP,Sertifikat Cara Budidaya Ikan yang Baik,Dit KP,,,,,
,,03229,Budidaya Ikan Air Tawar Di Media Lainnya,Dit KP,Sertifikat Cara Budidaya Ikan yang Baik,Dit KP,,,,,
